PS.No,DMK,NPP,AIADMK,BSP,MGR MK,NTK,MNM,AMMK,MIP,Dhesiya MK,API,INDs,Win - I,Win - II,Win - III,Win - IV,Win - V,Difference,Total Valid Votes,Votes for NOTA option,No. of Rejected Votes,Total Votes,"Location and Name of Building in
which Polling Station Located",Polling Area
1,331,2,139,2,0,20,19,2,0,0,0,3,DMK,AIADMK,NTK,MNM,INDs,-192,518,4,0,522,"CSI Polytechnic College, Yercaud Main Road, Salem-636007,
East Facing Room No-112","Salem (C), D.7.Bharathi Nagar (Yercaud Road)"
2,365,0,97,0,0,20,18,1,0,0,0,1,DMK,AIADMK,NTK,MNM,AMMK,-268,502,3,0,505,"CSI Polytechnic College, Yercaud Main Road, Salem-636007,
East Facing Room No-113","Salem (C), D.7.Bharathi Nagar (Yercaud Road)"
3,336,0,384,1,0,29,36,4,0,0,0,6,AIADMK,DMK,MNM,NTK,INDs,0,796,7,0,803,"Anderson Matric Hr.Sec.School, Sengodagounder salai Salem, North Facing Terraced Building South Wing Room No 2A","Salem (C), D.7,Attukadu (Backside of Collector Bungalow),Salem (C), D.7,Sengodagounder  Salai"
4,430,2,146,0,0,23,51,1,0,0,0,0,DMK,AIADMK,MNM,NTK,NPP,-284,653,5,0,658,"CSI Polytechnic College, Yercaud Main Road, Salem-636007,
West Facing North Wing Room No-117","Salem (C), D.7,TamilnaduHousing Unit,Salem (C), D.7,Thirunagar"
5,424,0,171,1,0,31,53,4,0,0,0,0,DMK,AIADMK,MNM,NTK,AMMK,-253,684,5,0,689,"CSI Polytechnic College, Yercaud Main Road, Salem-636007, Southern Terraced Building North Facing Hall-DHG-1","Salem(C), D 7 Meenakshi Nagar,Salem(C), D 7 Meenakshi Nagar TVS Nagar"
6,373,2,401,0,1,29,26,3,0,0,0,8,AIADMK,DMK,NTK,MNM,INDs,0,843,4,0,847,"CSI Polytechnic College, Yercaud Main Road, Salem-636007, Southern Terraced Building North Facing Hall-DHG-2","Salem (C), D 7, Kannankurichi Main Road,Salem(C), D 7 Kallikadu (Kudisai Area),Salem(C), D 7 Kallikkadu"
7,470,1,291,0,0,50,64,2,0,0,0,1,DMK,AIADMK,MNM,NTK,AMMK,-179,879,13,0,892,"CSI Polytechnic College, Yercaud Main Road, Salem-636007, Southern Terraced Building North Facing Hall-DHG-3","Salem (C), D.7,Kambarstreet"
8,280,1,276,2,0,32,37,0,0,0,0,5,DMK,AIADMK,MNM,NTK,INDs,-4,633,2,0,635,"CSI Polytechnic College, Yercaud Main Road, Salem-636007, Southern Terraced Building North Facing Hall-DHG-4","Salem (C), D.7,Backside of S.P.Bungalow,Salem (C), D.7,Kambarstreet (Pachudayarkadu),Salem (C), D.7,Pallakkadu,Salem (C), D.8,Vasanthapuram"
9,259,2,300,1,0,35,59,1,0,0,0,1,AIADMK,DMK,MNM,NTK,NPP,0,658,7,0,665,"CSI Hobert GHS School Hasthampatty Salem-636007, Facing
South Terraced Building West Portion","Salem (C), D.13,Central Jail Backside"
10,333,2,318,4,0,48,51,5,0,0,0,2,DMK,AIADMK,MNM,NTK,AMMK,-15,763,6,0,769,"CSI Hobert GHS School Hasthampatty Salem-636007, Facing
South Terraced Building Middle Portion","Salem (C), D.13,Central Jail Backside"
11,341,0,265,1,0,36,41,0,0,0,0,2,DMK,AIADMK,MNM,NTK,INDs,-76,686,1,0,687,"CSI Hobert GHS School Hasthampatty Salem-636007, Facing South Terraced Bulding Middle Portion","Salem (C), D 13, Christian Pet, Adaikala Nagar,Salem (C), D 13, Hasthampatti Mariamman Koil Street,Salem(C), D.13, Central Jail QuartersHousing Unit"
12,370,0,554,3,0,57,32,2,0,0,0,2,AIADMK,DMK,NTK,MNM,BSP,0,1020,7,0,1027,"SCMC Ele.School, Ayyanthirumaligai-636007, Facing North
Building Eastern Wing","Salem (C), D.7,IyyenThirumaligai,Salem (C), D.7,Kuzhandaigal Nala Kappaga
Street,Salem (C), D.7,MalStreet"
13,311,3,357,1,0,12,47,2,0,0,1,7,AIADMK,DMK,MNM,NTK,INDs,0,741,4,0,745,"SCMC Ele. School, Ayyanthirumaligai Salem-636007, Anganwadi New Terraced Building Facing West East Wing","Salem (C), D.7,First Street,Salem (C), D.7,Housing Unit Itteri Road,Salem (C), D.7,Keel Street,Salem (C), D.7,Nadustreet,Salem (C), D.7,Second Street,Salem (C), D.7,Syndicate Bank Colony,Salem (C), D.7,Vallalar Nagar"
14,427,0,195,0,0,43,41,1,0,0,1,4,DMK,AIADMK,NTK,MNM,INDs,-232,712,3,0,715,"SCMC Ele.School, Ayyanthirumaligai, Salem-636007, West Portion of North Facing Building","Salem (C), D.7,Collector Bungalow Backside Housing Unit,Salem (C), D.7,Housingunit IyyenThirumaligai,Salem (C), D.7,Yercaud Road Housing
Unit,Salem (C), D.7,YercaudRoad"
15,326,1,534,1,0,31,33,3,0,0,0,6,AIADMK,DMK,MNM,NTK,INDs,0,935,8,0,943,"SCMC Middle School, Chinnakollapatty, Facing South Terraced Building, West Wing","Salem(C), D 6 Yercaud Main Road, Gandhi Nagar East, Jeeva Street,Salem(C), D 6, Annaiindiranagar,Salem(C), D 6, Gandhistreet,Salem(C), D 6, Jeevathstreet,Salem(C), D 6, Thiruvalluvarnagar"
16,395,0,347,1,0,40,64,3,0,0,0,1,DMK,AIADMK,MNM,NTK,AMMK,-48,851,17,0,868,"SCMC Middle School, Chinna Kollapatty., Terraced Building
Facing South,  West Wing","Salem(C), D 6 AnnaiIndiranagar,Salem(C), D 6 Iyanarkoilkattuvalavu,Salem(C), D
6 Thiruvalluvar street (south)"
17,326,3,468,4,0,43,53,17,1,1,0,4,AIADMK,DMK,MNM,NTK,AMMK,0,920,6,0,926,"SCMC Middle School, Chinna Kollapatty, Salem-636008,
Terraced Building Facing South,  East Wing","Salem(C), D 6 Annasalai,Salem(C), D 6 Boyarstreet,Salem(C), D 6
G.K.V.Nagar,Salem(C), D 6 Saraswathinagar,Salem(C), D 6 Varmagarden"
18,248,1,461,2,0,21,12,8,0,0,0,3,AIADMK,DMK,NTK,MNM,AMMK,0,756,4,0,760,"SCMC Middle School, Chinnakollapatty, Building Facing South,
East Wing","Salem(C), D 6  Kaliammannagar,Salem(C), D 6 Pazhaniappakounder,Salem(C),
D6 Yercaudmainroad"
19,361,2,254,0,0,27,36,2,0,2,0,2,DMK,AIADMK,MNM,NTK,NPP,-107,686,6,0,692,"Mountmary s Matriculation School, Periyar Nagar (Room No.6) Chinnakollapatty,  North Terraced Building - South facing
Room No.9","Salem(C), D 6  K.K.Nagar West,Salem(C), D 6 K.K.nagar,Salem(C), D 6 Ponn Nagar West,Salem(C), D 6 PonnNagar East,Salem(C), D 6 Yercaud Main Road
West"
20,359,4,378,3,0,37,15,7,1,1,0,11,AIADMK,DMK,NTK,MNM,INDs,0,816,3,0,819,"Mountmary s Matriculation School, Periyar Nagar (Room No.6) Chinnakollapatty, Terraced Building Facing South, Middle Wing","Salem(C), D 6  Periyar nagar,Salem(C), D 6 Rajaganapathy nagar"
21,275,4,339,3,0,26,6,4,0,0,0,11,AIADMK,DMK,NTK,INDs,MNM,0,668,2,0,670,"Mountmary s Matriculation School, Periyar Nagar (Room No.7) Chinnakollapatty, Terraced Building Facing South, Middle Wing","Salem(C), D 6  Ayyankadu,Salem(C), D 6  Periyar nagar"
22,457,1,357,2,0,43,45,1,2,0,0,5,DMK,AIADMK,MNM,NTK,INDs,-100,913,4,0,917,"Mountmary s Matriculation School, Periyar Nagar (Room No.4) Chinnakollapatty, Terraced Building Facing South, Middle Wing","Salem(C), D 6  Kundathumedu,Salem(C), D 6  N.G.G.O.Colony,Salem(C), D 6 Santhinagar"
23,367,1,419,3,0,46,20,7,0,0,0,9,AIADMK,DMK,NTK,MNM,INDs,0,872,7,0,879,"SCMC Sainitory Inspector Office (Veterinary Hospital) Periya
Kollapatty., Facing West Terraced Building","Salem(C), D 6  Angalamman koil street,Salem(C), D 6  Mariammankoil
Street,Salem(C), D 6  Subramaniar koil Street"
24,367,0,190,1,1,47,52,3,2,0,0,2,DMK,AIADMK,MNM,NTK,AMMK,-177,665,5,0,670,"Government Higher Secondary School, Kannankurichi,
Terraced Building West Facing South Wing Room No 29","Salem(C), D 6 Housingunit,Salem(C), D 6 Kattuvalavu"
25,328,3,403,2,1,63,10,2,0,0,0,14,AIADMK,DMK,NTK,INDs,MNM,0,826,2,0,828,"SCMC Ele. School, Periya Kollapatty, Facing North Terraced
Building West Wing","Salem(C), D 6  Gandhinagar and new colony periakollappatty"
26,400,4,298,0,0,34,86,2,0,0,0,1,DMK,AIADMK,MNM,NTK,NPP,-102,825,4,0,829,"SCMC Ele. School, Periya Kollapatty, Salem-636008, Terraced
Building Facing North East Wing","Salem(C), D 6  Prakasam nagar mariammankoil melvattam,Salem(C), D 6
Kannankurichi Main Road and vijay Nagar"
27,268,0,304,0,0,26,41,2,0,0,0,10,AIADMK,DMK,MNM,NTK,INDs,0,651,8,0,659,"SCMC Ele.School, Periya Kollapatty, Salem-636008, West
Portion of South Facing Self Sufficent Building","Salem (C), D 6. Syndicate Colony Kurnichi Nagar 1,2 SakthiNagar
Annex,Salem(C), D 6  Ramasamy Nagar IInd Cross"
28,268,0,463,3,0,54,18,19,0,0,0,6,AIADMK,DMK,NTK,AMMK,MNM,0,831,9,0,840,"SCMC Ele.School, Periya Kollapatty, Salem-636008, East
Portion of South Facing Self Sufficent Building","Salem (C), D 6. Patchiamman Kovil, Kamarajar Road Jallikadu"
29,394,5,394,1,2,32,64,3,0,0,1,1,DMK,DMK,MNM,NTK,NPP,0,897,14,0,911,"SCMC Ele.School, Self Sufficienty Scheme  Periya Kollapatty, Terraced Building Facing South West Portion","Salem(C), D 6  Judge road Indira nagar,Salem(C), D 6  Ramanathapuram
,Kannankurichi main road,Salem(C), D 6  Ramasamy nagar Ist Cross,Salem(C), D 6 Kalyani nagar1,2,Salem(C), D 6 Nataraj nagar and judge road south side,Salem(C), D 6 Perumal koil thottam"
30,336,1,192,1,2,22,33,1,0,0,1,2,DMK,AIADMK,MNM,NTK,MGR MK,-144,591,3,0,594,"PUMS, Kannankurichi, Salem-636008, New Terraced Building Facing East North Wing","Kannankurichi (TP), Ward4, Desaichinnaponnustreet,Kannankurichi (TP), Ward4, Gopal Street,Kannankurichi (TP), Ward4, Karuppannan Street,Kannankurichi (TP), Ward4, Natarajan Street,Kannankurichi (TP), Ward4, PannaiarSubbarayan Street,Kannankurichi (TP), Ward4, Venkatachalam Street"
31,477,1,415,0,0,44,34,4,0,0,0,5,DMK,AIADMK,NTK,MNM,INDs,-62,980,1,0,981,"PUMS, Kannankurichi, Salem-636008, South Portion of East Facing Terraced Building","Kannankurichi (TP), Ward3, AC Gopal Street,Kannankurichi (TP), Ward3, Arumugam Street,Kannankurichi (TP), Ward3, KurichaNarayanan Street,Kannankurichi (TP), Ward3, L.B.Chetty Street,Kannankurichi (TP), Ward3, Natarajan Street,Kannankurichi (TP), Ward3, R.K.Ramanujam Street,Kannankurichi (TP), Ward3, Subbarayan Street,Kannankurichi (TP),
Ward3, Sundaram Street"
32,329,1,231,1,0,16,26,0,0,0,0,5,DMK,AIADMK,MNM,NTK,INDs,-98,609,2,0,611,"PUMS, Kannankurichi Salem-636008, Terraced Building Facing West, Eastern Side of South Wing","Kannankurichi (TP), Ward5, Dasaramarimuthu Street,Kannankurichi (TP), Ward5, Muthusamy Street,Kannankurichi (TP), Ward5, Narayanan Street,Kannankurichi (TP), Ward5, Pazhaniappan Street,Kannankurichi (TP), Ward5, Selvam Street,Kannankurichi (TP), Ward5, StreetNo.6,Kannankurichi (TP), Ward5, StreetNo.8,Kannankurichi (TP), Ward5, T.K.V. Rajagopal Street,Kannankurichi (TP), Ward5, V.K.Perumal Street,Kannankurichi (TP), Ward6, Chinna Mariamman Koil Street,Kannankurichi (TP), Ward6, K.R.Ezhumalai Street,Kannankurichi (TP), Ward6, Kunjan Street,Kannankurichi (TP), Ward6, Subbu Street,Kannankurichi (TP), Ward6, Thambu Street"
33,266,0,230,0,0,11,12,0,0,0,0,10,DMK,AIADMK,MNM,NTK,INDs,-36,529,5,0,534,"PUMS, Kannankurichi, Terraced Building Facing West, North wing","Kannankurichi (TP), Ward5, Perumal Street,Kannankurichi (TP), Ward5, StreetNo.5,Kannankurichi (TP), Ward6, K.S.Arumugam Street,Kannankurichi (TP), Ward6, K.V.Annamalai Street,Kannankurichi (TP), Ward6, Kannia Street,Kannankurichi (TP), Ward7, Poomalai Street,Kannankurichi (TP), Ward7,
Santhastreet"
34,299,0,193,0,0,32,42,1,0,0,0,3,DMK,AIADMK,MNM,NTK,INDs,-106,570,11,0,581,"PUMS, Kannankurichi, Terraced Building Facing West Middle
Wing","Kannankurichi (TP), Ward12, Mahalakshmi Nagar,Kannankurichi (TP), Ward12,
Salem Road,Salem  (C), D 8, M.G.R.Nagar"
35,392,1,265,0,0,28,46,2,0,0,0,1,DMK,AIADMK,MNM,NTK,AMMK,-127,735,3,0,738,"PUMS, Kannankurichi, Southern Terraced Building Facing North","Kannankurichi (TP), Ward12, Arumugam Ayyer Street,Kannankurichi (TP),
Ward12, Karpagam Nagar (Rajnagar),Kannankurichi (TP), Ward12, Venkateswara Nagar,Salem  (C), D 8, Yercaud Road"
36,365,1,403,0,0,26,5,2,0,1,0,9,AIADMK,DMK,NTK,INDs,MNM,0,812,1,0,813,"PUMS, Kannankurichi, Terraced Building Facing West, South Wing","Kannankurichi (TP), Ward7, Ammaiappan Street,Kannankurichi (TP), Ward7, Arumugam Street,Kannankurichi (TP), Ward7, K.S.Arumugam Street,Kannankurichi (TP), Ward7, Kandasamy Street,Kannankurichi (TP), Ward7, Seerangan Street,Kannankurichi (TP), Ward8, Arunachalam Street No.3,Kannankurichi (TP), Ward8, PerumalKoil Street"
37,584,3,449,3,2,21,13,1,0,0,0,8,DMK,AIADMK,NTK,MNM,INDs,-135,1084,2,0,1086,"GHSS, Kannankurichi, Terraced Building Facing North West Wing Room No.37","Kannankurichi (TP), Ward8, Arunachalam Street,Kannankurichi (TP), Ward8, Govindan Street,Kannankurichi (TP), Ward8, Kaliammankoil Street,Kannankurichi (TP), Ward8, Selvam Street,Kannankurichi (TP), Ward9, Chinnannan Street,Kannankurichi (TP), Ward9, LakshmananColony,Kannankurichi (TP), Ward9, Sathyacolony,Kannankurichi
(TP), Ward9, Yerappan Street"
38,462,3,464,2,3,31,19,4,0,0,0,18,AIADMK,DMK,NTK,MNM,INDs,0,1006,5,0,1011,"GHSS, Kannankurichi, Terraced Building Facing South Terraced
Building Middle Portion Room No.17","Kannankurichi (TP), Ward1, Kattuvattam"
39,326,1,371,2,2,43,52,4,0,0,0,1,AIADMK,DMK,MNM,NTK,AMMK,0,802,7,0,809,"GHSS, Kannankurichi, Salem-636008, East Portion of South
Facing Terraced Building Room No 18","Kannankurichi (TP), Ward14, PacharoadYercaudmain Road"
40,470,1,310,1,0,54,42,1,0,0,0,6,DMK,AIADMK,NTK,MNM,INDs,-160,885,9,0,894,"GHSS, Kannankurichi, Salem-636008, East Portion of South Facing Terraced Building Room No 24","Kannankurichi (TP), Ward13, MarimuthuStreet,Kannankurichi (TP), Ward13, PethanStreet,Kannankurichi (TP), Ward14, Pacharoad Yercaud main Road"
41,457,1,432,1,1,39,20,3,0,0,2,7,DMK,AIADMK,NTK,MNM,INDs,-25,963,4,0,967,"GHSS, Kannankurichi, New Terraced Building Facing East South
Wing Room No 40","Kannankurichi (TP), Ward13, Kandasamy Street,Kannankurichi (TP), Ward2,
PachiammanNagar"
42,409,2,284,1,0,28,21,1,0,0,0,2,DMK,AIADMK,NTK,MNM,NPP,-125,748,5,0,753,"GHSS, Kannankurichi, Salem-636008, Terraced Facing East
Western Building Middle Wing Room No 41","Kannankurichi (TP), Ward1, SeviColony,Kannankurichi (TP), Ward13,
Govindasamy Street,Kannankurichi (TP), Ward2, Saravana Nagar"
43,452,2,206,3,0,49,28,1,0,0,0,3,DMK,AIADMK,NTK,MNM,BSP,-246,744,2,0,746,"GHSS, Kannankurichi, Salem-636008, Terraced Facing East
Wester Building Middle Wing Room No 42","Kannankurichi (TP), Ward13, Govindasamy Colony"
44,694,5,470,3,0,41,10,2,0,0,0,10,DMK,AIADMK,NTK,MNM,MNM,-224,1235,3,0,1238,"PUMS, Thamarai Nagar, Kannankurichi., Terraced Building
Facing East, North Wing","Kannankurichi (TP), Ward15,Thamari Nagar"
45,509,4,439,0,0,46,26,2,0,0,0,4,DMK,AIADMK,NTK,MNM,NPP,-70,1030,10,0,1040,"PUMS, Kannankurichi, Terraced Building Facing East Middle
Portion","Kannankurichi (TP), Ward11, Kesavannagar,Kannankurichi (TP), Ward11,
Melmottankurichi"
46,547,3,571,2,0,39,35,3,0,1,0,6,AIADMK,DMK,NTK,MNM,INDs,0,1207,9,0,1216,"PUES, Motankurichi, Kannakurichi, Asbestas Building Facing
West, North Wing","Kannankurichi (TP), Ward10, MottankurichiErikadu1"
47,189,0,230,0,0,10,2,1,0,0,0,1,AIADMK,DMK,NTK,MNM,AMMK,0,433,3,0,436,"PUES, Motankurichi Kannakurichi, Asbestas Building Facing
West, South Wing","Kannankurichi  (TP), Ward10, Mottankurichimurugankoil2"
48,398,0,330,0,1,43,51,3,0,0,0,5,DMK,AIADMK,MNM,NTK,INDs,-68,831,5,0,836,"PUE School, Ramanathapuram, Kannankurichi, Salem-636008, West Portion of South Facing New Terraced Building","Salem(C), D 8, Bungalow Nagar,Salem(C), D 8, Indiranagar,Salem(C), D 8, Nithyanagar2nd Street,Salem(C), D 8, Nithyanagar2nd Street Extension,Salem(C), D 8, Pandianstreet,Salem(C), D 8, Santhiavenue,Salem(C),
D8,Nithiyanagar 1st"
49,432,3,369,1,1,25,71,1,0,0,0,2,DMK,AIADMK,MNM,NTK,NPP,-63,905,6,0,911,"SCMC Ele.School, Ramanathapuram, Kannankurichi, Salem- 636008, East Portion of South Facing New Terraced Building","Salem(C), D 8, Athayammal 1st Street,Salem(C), D 8, Balajinagar,Salem(C), D 8, Mullainagar,Salem(C), D 8, Ramanathapuram"
50,309,2,612,4,0,23,24,1,0,0,0,11,AIADMK,DMK,MNM,NTK,INDs,0,986,6,0,992,"Suba Primary School, Mahendrapuri, West Terraced Building
East Facing Room No.1","Salem (C), D 8, Gandhinagar,Salem(C), D 8,Annasalai East"
51,468,2,253,1,2,37,45,0,0,0,0,2,DMK,AIADMK,MNM,NTK,NPP,-215,810,6,0,816,"Suba Primary School, Mahendrapuri, West Terraced Building East Facing Room No.2","Salem(C), D 8, Athayammal IInd Street,Salem(C), D 8, Kamarajnagar,Salem(C), D 8, Kamatchinagar,Salem(C), D 8, Kattabommanstreet, Karnan street,Salem(C),
D.8.Cholan Street"
52,419,1,240,0,0,35,84,2,0,0,1,2,DMK,AIADMK,MNM,NTK,AMMK,-179,784,8,0,792,"Suba Primary School, Mahendrapuri, West Terraced Building East Facing Room No.3","Salem(C), D 8, Asokansalai,Salem(C), D 8, Kalingasalai,Salem(C), D 8, Kambar Street,Salem(C), D 8, Paristreet,Salem(C), D 8, QueensCircle,Salem(C), D 8,
S.C.C.B. Colony,Salem(C), D 8, Sivajisalai, Sibistreet (Prince Circle),Salem(C), D 8, Subbarayansalai,Salem(C), D.8.Meenachi Nagar"
53,329,2,332,1,1,31,18,10,0,0,0,6,AIADMK,DMK,NTK,MNM,AMMK,0,730,2,0,732,"Anderson Matric Hr.Sec.School, Sengodagounder salai Salem,
West Terraced Building East North Wing","Salem (C), D 8 Atthukadu,Salem (C), D 8 Atthukadu,karadu,Salem (C), D 8
Pandiyan street,Salem (C), D 8 Yercaud Road"
54,381,4,224,0,1,32,26,4,0,0,0,2,DMK,AIADMK,NTK,MNM,NPP,-157,674,2,0,676,"Anderson Matric Hr.Sec.School, Sengodagounder salai Salem, West Facing Terraced Building East Room No.5A","Salem (C), D 8 Jayapal line,Salem (C), D 8 Rajeev Nagar,Salem (C), D 8 Rathinapuri,Salem (C), D 8 Seetha Garden,Salem (C), D 8 Sengodagounder Salai
,North,Salem (C), D 8Anbu Nagar,Salem (C), D 8 Mepillavar Garden"
55,496,1,217,0,1,45,59,3,0,0,0,4,DMK,AIADMK,MNM,NTK,INDs,-279,826,5,0,831,"Jayalakshmi Vidayalaya High School, Near Housing Board, Pallakkadu, South Portion of East Facing Main Building","Salem (C), D 8  Bharathi nagar,Salem (C), D 8  Pallakkadu, Salem (C), D 8 Lakshmipuram, Salem (C), D 8 Vishwankadu"
56,428,1,401,1,0,54,73,1,0,0,0,3,DMK,AIADMK,MNM,NTK,INDs,-27,962,9,0,971,"SCMC Midde.School, Chinna Thirupathi, Facing South Terraced Building West Wing.","Salem(C), D 8 Seran Street,Salem(C), D 8 Solan Street,Salem(C), D 8 Srinivasan
Nagar,Salem(C), D 8 Thiruvalluvar Salai,Salem(C), D 8, Gogul Nagar,Salem(C), D 8, Ragavan Street"
57,517,0,314,0,0,38,62,1,0,0,0,3,DMK,AIADMK,MNM,NTK,INDs,-203,935,6,0,941,"SCMC Midde School, Chinna Thirupathi, New Terraced Building HM Room Additional Building Facing North","Salem(C), D 8 , Lakashmi Nagar,Salem(C), D 8 Abirami Garden,Salem(C), D 8 Pandiyan Street,Salem(C), D 8 Rajaganapathi Nagar,Salem(C), D 8 Varatharajan Nagar,Salem(C), D 8, Saraswathi Nagar,Salem(C), D 8, Sri Ganapathi Nagar"
58,368,0,231,0,0,40,53,1,0,0,0,4,DMK,AIADMK,MNM,NTK,INDs,-137,697,10,0,707,"SCMC Middle School, Chinna Thirupathi., Facing West,
Terraced Building North Wing.","Salem(C), D 8 Gurukkal Colony,Salem(C), D 8 P.T.Colony,Salem(C), D 8
Sevigounder Street, Thiruvalluvar salai"
59,419,1,326,2,3,25,70,8,0,0,0,2,DMK,AIADMK,MNM,NTK,AMMK,-93,856,6,0,862,"SCMC Middle School, Chinna Thirupathi, Salem-636008, West Facing Terraced Building South Portion","Salem(C), D 8  Rani Annanagar Kattuvalavu,Salem(C), D 8 Chandran Gardan,Salem(C), D 8 Indiragandhi Street,Salem(C), D 8 Iyyam Perumal Street,Salem(C), D 8 Mariyamman Kovil Street,Salem(C), D 8 Rani Anna Nagar"
60,471,0,185,0,1,27,31,1,0,0,0,3,DMK,AIADMK,MNM,NTK,INDs,-286,719,5,0,724,"SCMC Middle School, Chinnathirupathi, Terraced Building
Facing South,East Wing","Salem(C), D 8  Annasalai"
61,429,2,265,1,1,39,60,1,0,0,0,5,DMK,AIADMK,MNM,NTK,INDs,-164,803,4,0,807,"Jairam Higher Secondary School Chinnathirupathi, West Facing Terraced Building Room No 9","Salem(C), D 8  Santhinagar,Salem(C), D 8  Srinivasanagar,Salem(C), D 8 Santhosh Nagar,Salem(C), D 8, Ishwariya Garden,Salem(C), D 8, Vaishnavi Garden"
62,319,0,151,0,0,24,31,1,0,0,1,5,DMK,AIADMK,MNM,NTK,INDs,-168,532,5,0,537,"SCMC Middle School, Chinnathirupathi, Salem-636008, Terraced Building Facing North","Salem(C), D 8  Kamarajarnagar2nd street,Salem(C), D 8 Kamarajar 2nd street,Salem(C), D 8 Kamarajarnagar 1st street,Salem(C), D 8 Kamrajar 1st
street, Salem(C), D  8  Kamarajar 3 street"
63,332,0,521,3,0,48,44,5,0,0,0,4,AIADMK,DMK,NTK,MNM,AMMK,0,957,7,0,964,"Jairam Higher Secondary School Chinnathirupathi, West Facing
Terraced Building Room No 10","Salem(C), D 8  Amman nagar,Salem(C), D 8  Ayyanarkoil kadu,Salem(C), D 8
Srivishnupathy Nagar"
64,259,0,299,1,0,41,47,5,0,0,0,2,AIADMK,DMK,MNM,NTK,AMMK,0,654,6,0,660,"SCMC Middle School, Chinnathirupathi, New Building Facing
South, West Wing","Salem(C), D  8 ,Ashok Nagar,Salem(C), D  8 Vettukadu,Salem(C), D 8 ,Annamalai
Nagar,Salem(C), D 8 Maruthi Nagar"
65,357,2,451,3,0,53,51,3,0,0,0,8,AIADMK,DMK,NTK,MNM,INDs,0,928,12,0,940,"SCMC Middle.School, Chinnathirupathi, Facing South Terraced Building East Wing","Salem(C), D 8, Logu Nagar,Salem(C), D 8, Mookaneri Adikerai Porampoku
,Salem(C), D 8, N.G.G.O.Colony,Salem(C), D 8, Yerikarai Road"
66,351,2,371,1,0,34,47,4,0,0,0,6,AIADMK,DMK,MNM,NTK,INDs,0,816,7,0,823,"SCMC Middle School, Chinnathirupathi, Salem-636008,
Asbestas Building Noon Meal Centre North Facing","Salem(C), D 8, Kannakurichi Main Road,Salem(C), D 8, M.G.R.Nagar,Salem(C), D
8, N.G.G.O.Colony Annexue"
67,311,1,200,0,0,25,12,1,0,0,0,1,DMK,AIADMK,NTK,MNM,NPP,-111,551,0,0,551,"SCMC Kamaraj Girls HSS, Court Road, Manakkadu, Terraced Building Facing West of East Side Building","Salem (C), D.13,Johnsonpet West Street1,Salem (C), D.13,Johnsonpet West Street2,Salem (C), D.13,Johnsonpet West Street3,Salem (C), D.13,Johnsonpet West Street4,Salem (C), D.13,Johnsonpet West Street5,Salem (C),
D.13,Johnsonpet West Street6"
68,399,3,157,1,0,24,19,1,0,1,0,2,DMK,AIADMK,NTK,MNM,NPP,-242,607,5,0,612,"SCMC Kamaraj Girls HSS, Court Road, Manakkadu, East Portion of North Facing New Terraced Building","Salem (C), D.12,Court Road,Salem (C), D.13,Johnsonpet West Street7,Salem (C), D.13,Johnsonpet West Street8,Salem (C), D.13,Johnsonpet West Street9"
69,417,0,266,4,1,33,42,3,1,0,0,4,DMK,AIADMK,MNM,NTK,BSP,-151,771,5,0,776,"SCMC Kamaraj Girls HSS, Court Road, Manakkadu, New
Building Facing South Eastern Portion IInd Room","Salem (C), D.12,Pilliar Nagar 3,Salem (C), D.13,Manakkadu Itteri Road"
70,429,1,184,0,0,34,34,2,0,0,0,1,DMK,AIADMK,NTK,NTK,AMMK,-245,685,6,0,691,"Bharathi Vidyalaya Higher Secondary School Maravaneri, South Side Terraced Building North Facing Room No 57","Salem (C), D.12, CourtRoad (K.A.S.Nagar)"
71,385,0,318,0,0,44,57,2,0,0,0,4,DMK,AIADMK,MNM,NTK,INDs,-67,810,6,0,816,"Bharathi Vidyalaya Higher Secondary School Maravaneri, South Side Building North Facing Room No 56","Salem (C), D.12, Gandhinagarmaravaneri,Salem (C), D.12,Court Road (Pilliar Kovil Street),Salem(C), D.12, Courtroad Pilliar Nagar"
72,510,2,315,1,1,59,46,4,0,0,0,3,DMK,AIADMK,NTK,MNM,AMMK,-195,941,10,0,951,"Bharathi Vidyalaya Higher Secondary School Maravaneri, South Side Building North Facing Room No 55","Salem (C), D.12, Court Road Pilliar Nagar1,Salem (C), D.12, Court Road Pilliar Nagar2"
73,305,0,216,1,1,39,17,2,1,0,1,6,DMK,AIADMK,NTK,MNM,INDs,-89,589,4,0,593,"SCMC Kamaraj Girls HSS, Court Road, Manakkadu, The New
Terraced Building Facing South","Salem (C), D.12, Johnsonpet East Street9,Salem (C), D.12,Court Road
(Manakkadu)"
74,415,0,256,0,0,30,31,0,1,0,0,4,DMK,AIADMK,MNM,NTK,INDs,-159,737,6,0,743,"SCMC Kamaraj Girls HSS, Court Road, Manakkadu, Salem-
636007, South Facing New Terraced Building","Salem (C), D.12, Johnsonpet East Street8,Salem (C), D.13, Rajamanickam Street"
75,441,5,249,2,0,39,9,5,0,1,0,2,DMK,AIADMK,NTK,MNM,NPP,-192,753,4,0,757,"SCMC Kamaraj Girls HSS, Court Road, Manakkadu, Salem- 636007, West Portion of North Facing Building","Salem (C), D.12, Johnsonpet East Street 9(Kudisai Paguthi),Salem (C),
D.12,Johnsonpet east street5,Salem (C), D.12,Johnsonpet east street6,Salem (C), D.12,Johnsonpet east street7"
76,427,1,221,0,0,34,20,5,0,0,0,4,DMK,AIADMK,NTK,MNM,AMMK,-206,712,5,0,717,"SCMC Kamaraj Girls HSS, Court Road, Manakkadu, Salem- 636007, North Portion of West Facing New Terraced Building","Salem (C), D.12,Johnsonpet east street1,Salem (C), D.12,Johnsonpet east street3,Salem (C), D.12,Johnsonpet east street4,Salem (C), D.12,Johnsonpeteast
street2,Salem (C), D.13, Subbarayan Layout"
77,438,1,281,2,0,62,16,1,0,0,1,4,DMK,AIADMK,NTK,MNM,INDs,-157,806,1,0,807,"Bharathi Vidyalaya Higher Secondary School Maravaneri,
Room No 36 Leap 2004 Block Facing South","Salem (C), D.12,Chinnathirupathy Road,Salem (C), D.12,Court Road
Colony,Salem (C), D.12,Kakkayankadu"
78,279,0,111,0,0,23,27,0,0,0,0,1,DMK,AIADMK,MNM,NTK,INDs,-168,441,2,0,443,"SCMC Kamaraj Girls HSS, Court Road, Manakkadu, Salem- 636007, East Portion of West Facing New Terraced Building","Salem (C), D.12,Rajanagar"
79,334,1,255,0,0,44,29,6,0,0,2,0,DMK,AIADMK,NTK,MNM,AMMK,-79,671,2,0,673,"Bharathi Vidyalaya Higher Secondary School Maravaneri, East
Facing Main Building Room No 4","Salem (C), D.12, Courtmain  Road,Salem (C), D.12,Kakkayankadu, Court road,
Colony"
80,377,1,146,0,1,30,17,1,0,0,0,3,DMK,AIADMK,NTK,MNM,INDs,-231,576,4,0,580,"SCMC Kamaraj Girls HSS, Court Road, Manakkadu, Salem- 636007, South Portion of West Facing New Terraced Building","Salem (C), D.12,RajaGanapathi Nagar"
81,321,0,107,0,1,27,26,2,0,0,0,4,DMK,AIADMK,NTK,MNM,INDs,-214,488,5,0,493,"SCMC Ele.School, Manakkadu., Terraced Building Facing West
Eastern side of South Wing","Salem (C), D.12,Manakkadu East Street"
82,346,1,187,1,0,28,33,1,0,0,0,3,DMK,AIADMK,MNM,NTK,INDs,-159,600,3,0,603,"SCMC Ele.School, Manakkadu, Terraced Building Facing South,
West wing","Salem (C), D.12,Manakkadu East Street"
83,522,3,202,1,1,30,30,1,1,0,0,1,DMK,AIADMK,NTK,NTK,NPP,-320,792,4,0,796,"SCMC Ele.School, Manakkadu, Terraced Building Facing South,
East  Wing","Salem (C), D.12,Manakkadu East Street,Salem (C), D.13,Manakkadu West
Vinayakar Street"
84,304,2,401,0,0,17,29,2,0,0,1,3,AIADMK,DMK,MNM,NTK,INDs,0,759,5,0,764,"SCMC Ele.School, Manakkadu, Terraced Building Facing West,
Eastern side of North Wing","Salem (C), D.12,Manakkadu Mariamman Koil Street,Salem (C), D.13,Manakadu
South Street"
85,314,0,195,1,1,14,27,1,0,0,0,0,DMK,AIADMK,MNM,NTK,BSP,-119,553,8,0,561,"C.S.I. Hobert Ele. School, Hasthampatty, Salem-636007, West Portion of South Side East Facing Terraced Building","Salem (C), D.13,Hasthampatty main road,Salem (C), D.13,Kalaivanar Street,Salem (C), D.13,Kullar street"
86,369,1,190,5,0,17,48,0,0,0,0,3,DMK,AIADMK,MNM,NTK,BSP,-179,633,1,0,634,"C.S.I. Hobert Ele. School, Hasthampatty, Salem-636007, West Portion of North Side East Facing Terraced Building","Salem (C), D.13,Govindan Extension,Salem (C), D.13,Johnsonpet Itteri road,Salem (C), D.13,Pazhaniappa Nagar"
